{
  "/Users/marcosotomaceda/Desktop/serverless-hack/serverless.yml": {
    "versionFramework": "4.23.0",
    "servicePath": "/Users/marcosotomaceda/Desktop/serverless-hack/serverless.yml",
    "serviceConfigFileName": "serverless.yml",
    "service": {
      "org": "marcosotomac",
      "service": "alertautec-auth",
      "provider": {
        "name": "aws",
        "stage": "${opt:stage, 'dev'}",
        "region": "us-east-1",
        "runtime": "python3.11",
        "memorySize": 1024,
        "timeout": 30,
        "websocketsApiName": "${self:service}-ws-${sls:stage}",
        "websocketsApiRouteSelectionExpression": "$request.body.action",
        "httpApi": {
          "cors": {
            "allowedOrigins": [
              "*"
            ],
            "allowedHeaders": [
              "Content-Type",
              "Authorization",
              "X-Requested-With"
            ],
            "allowedMethods": [
              "OPTIONS",
              "GET",
              "POST",
              "PATCH",
              "PUT",
              "DELETE"
            ],
            "maxAge": 300
          }
        },
        "environment": {
          "USERS_TABLE": "${self:custom.usersTableName}",
          "AUTH_SECRET": "<REDACTED>",
          "SMTP_FROM_ADDRESS": "${opt:smtpFrom, env:SMTP_FROM_ADDRESS, 'marco.soto.m@utec.edu.pe'}",
          "SMTP_USERNAME": "${opt:smtpUser, env:SMTP_USERNAME, 'marco.soto.m@utec.edu.pe'}",
          "SMTP_PASSWORD": "<REDACTED>",
          "SMTP_HOST": "${opt:smtpHost, env:SMTP_HOST, 'smtp.gmail.com'}",
          "SMTP_PORT": "${opt:smtpPort, env:SMTP_PORT, '587'}",
          "INCIDENTS_TABLE": "${self:custom.incidentsTableName}",
          "CONNECTIONS_TABLE": "${self:custom.connectionsTableName}",
          "CONNECTION_TTL_SECONDS": "${opt:connectionTtl, env:CONNECTION_TTL_SECONDS, '3600'}",
          "SAGEMAKER_ENDPOINT_NAME": "${opt:sagemakerEndpoint, env:SAGEMAKER_ENDPOINT_NAME, ''}",
          "MEDIA_BUCKET_NAME": "${self:custom.mediaBucketName}",
          "WEBSOCKET_API_ENDPOINT": {
            "Fn::Join": [
              "",
              [
                "https://",
                {
                  "Ref": "WebsocketsApi"
                },
                ".execute-api.",
                "${self:provider.region}",
                ".amazonaws.com/",
                "${self:provider.stage}"
              ]
            ]
          }
        },
        "iam": {
          "role": "arn:aws:iam::590953801135:role/LabRole"
        }
      },
      "functions": {
        "register": {
          "handler": "src/handlers/auth/register.handler",
          "description": "Registers an institutional user and stores hashed credentials.",
          "timeout": 10,
          "events": [
            {
              "httpApi": {
                "method": "post",
                "path": "/auth/register"
              }
            }
          ]
        },
        "login": {
          "handler": "src/handlers/auth/login.handler",
          "description": "Authenticates a user with institutional credentials and issues a session token.",
          "timeout": 10,
          "events": [
            {
              "httpApi": {
                "method": "post",
                "path": "/auth/login"
              }
            }
          ]
        },
        "createIncident": {
          "handler": "src/handlers/incidents/create.handler",
          "description": "Creates a new incident report with urgency and location metadata.",
          "timeout": 10,
          "events": [
            {
              "httpApi": {
                "method": "post",
                "path": "/incidents"
              }
            }
          ]
        },
        "listIncidents": {
          "handler": "src/handlers/incidents/list.handler",
          "description": "Lists incidents for dashboards with optional status filtering.",
          "timeout": 10,
          "events": [
            {
              "httpApi": {
                "method": "get",
                "path": "/incidents"
              }
            }
          ]
        },
        "adminListIncidents": {
          "handler": "src/handlers/incidents/admin_list.handler",
          "description": "Allows authorities to view and filter all active incidents.",
          "timeout": 10,
          "events": [
            {
              "httpApi": {
                "method": "get",
                "path": "/admin/incidents"
              }
            }
          ]
        },
        "updateIncident": {
          "handler": "src/handlers/incidents/update.handler",
          "description": "Updates incident status or assignment, reserved for personal/autoridad roles.",
          "timeout": 10,
          "events": [
            {
              "httpApi": {
                "method": "patch",
                "path": "/incidents/{incidentId}"
              }
            }
          ]
        },
        "prioritizeIncident": {
          "handler": "src/handlers/incidents/prioritize.handler",
          "description": "Permite a autoridades priorizar incidentes para el panel.",
          "timeout": 10,
          "events": [
            {
              "httpApi": {
                "method": "patch",
                "path": "/incidents/{incidentId}/priority"
              }
            }
          ]
        },
        "closeIncident": {
          "handler": "src/handlers/incidents/close.handler",
          "description": "Marca un incidente como resuelto desde el panel administrativo.",
          "timeout": 10,
          "events": [
            {
              "httpApi": {
                "method": "patch",
                "path": "/incidents/{incidentId}/close"
              }
            }
          ]
        },
        "incidentHistory": {
          "handler": "src/handlers/incidents/history.handler",
          "description": "Devuelve el historial completo de acciones de un incidente.",
          "timeout": 10,
          "events": [
            {
              "httpApi": {
                "method": "get",
                "path": "/incidents/{incidentId}/history"
              }
            }
          ]
        },
        "requestMediaUpload": {
          "handler": "src/handlers/incidents/request_upload.handler",
          "description": "Genera URLs prefirmadas para subir im치genes o videos de incidentes.",
          "timeout": 10,
          "events": [
            {
              "httpApi": {
                "method": "post",
                "path": "/incidents/media/upload"
              }
            }
          ]
        },
        "getMediaUrl": {
          "handler": "src/handlers/incidents/get_media_url.handler",
          "description": "Genera URLs firmadas de lectura para archivos multimedia de incidentes.",
          "timeout": 10,
          "events": [
            {
              "httpApi": {
                "method": "get",
                "path": "/incidents/media/{objectKey+}"
              }
            }
          ]
        },
        "commentIncident": {
          "handler": "src/handlers/incidents/comment.handler",
          "description": "Permite a usuarios dejar comentarios en un incidente.",
          "timeout": 10,
          "events": [
            {
              "httpApi": {
                "method": "post",
                "path": "/incidents/{incidentId}/comments"
              }
            }
          ]
        },
        "voteSignificance": {
          "handler": "src/handlers/incidents/significance.handler",
          "description": "Incrementa la relevancia (significancia) de un incidente.",
          "timeout": 10,
          "events": [
            {
              "httpApi": {
                "method": "post",
                "path": "/incidents/{incidentId}/significance"
              }
            }
          ]
        },
        "predictIncidents": {
          "handler": "src/handlers/analytics/predict.handler",
          "description": "Consulta SageMaker para identificar patrones y predicciones de riesgos.",
          "timeout": 15,
          "memorySize": 2048,
          "events": [
            {
              "httpApi": {
                "method": "post",
                "path": "/analytics/predictions"
              }
            }
          ]
        },
        "wsConnect": {
          "handler": "src/handlers/ws/connect.handler",
          "description": "Registers a WebSocket connection associated to the authenticated user.",
          "events": [
            {
              "websocket": "$connect"
            }
          ]
        },
        "wsDisconnect": {
          "handler": "src/handlers/ws/disconnect.handler",
          "description": "Cleans up WebSocket connections when clients disconnect.",
          "events": [
            {
              "websocket": "$disconnect"
            }
          ]
        },
        "wsDefault": {
          "handler": "src/handlers/ws/default.handler",
          "description": "Handles fallback WebSocket messages (pings/unsupported actions).",
          "events": [
            {
              "websocket": "$default"
            }
          ]
        },
        "wsPing": {
          "handler": "src/handlers/ws/ping.handler",
          "description": "Mantiene viva la conexi칩n y renueva el TTL para conexiones activas.",
          "events": [
            {
              "websocket": "ping"
            }
          ]
        }
      },
      "package": {
        "patterns": [
          "!node_modules/**",
          "!venv/**"
        ]
      },
      "custom": {
        "usersTableName": "${self:service}-users-${sls:stage}",
        "incidentsTableName": "${self:service}-incidents-${sls:stage}",
        "connectionsTableName": "${self:service}-connections-${sls:stage}",
        "mediaBucketName": "${self:service}-media-${sls:stage}"
      },
      "resources": {
        "Resources": {
          "UsersTable": {
            "Type": "AWS::DynamoDB::Table",
            "Properties": {
              "TableName": "${self:custom.usersTableName}",
              "BillingMode": "PAY_PER_REQUEST",
              "AttributeDefinitions": [
                {
                  "AttributeName": "email",
                  "AttributeType": "S"
                }
              ],
              "KeySchema": [
                {
                  "AttributeName": "email",
                  "KeyType": "HASH"
                }
              ]
            }
          },
          "IncidentsTable": {
            "Type": "AWS::DynamoDB::Table",
            "Properties": {
              "TableName": "${self:custom.incidentsTableName}",
              "BillingMode": "PAY_PER_REQUEST",
              "AttributeDefinitions": [
                {
                  "AttributeName": "incidentId",
                  "AttributeType": "S"
                },
                {
                  "AttributeName": "status",
                  "AttributeType": "S"
                }
              ],
              "KeySchema": [
                {
                  "AttributeName": "incidentId",
                  "KeyType": "HASH"
                }
              ],
              "GlobalSecondaryIndexes": [
                {
                  "IndexName": "status-index",
                  "KeySchema": [
                    {
                      "AttributeName": "status",
                      "KeyType": "HASH"
                    }
                  ],
                  "Projection": {
                    "ProjectionType": "ALL"
                  }
                }
              ]
            }
          },
          "ConnectionsTable": {
            "Type": "AWS::DynamoDB::Table",
            "Properties": {
              "TableName": "${self:custom.connectionsTableName}",
              "BillingMode": "PAY_PER_REQUEST",
              "AttributeDefinitions": [
                {
                  "AttributeName": "connectionId",
                  "AttributeType": "S"
                },
                {
                  "AttributeName": "role",
                  "AttributeType": "S"
                },
                {
                  "AttributeName": "user",
                  "AttributeType": "S"
                }
              ],
              "KeySchema": [
                {
                  "AttributeName": "connectionId",
                  "KeyType": "HASH"
                }
              ],
              "GlobalSecondaryIndexes": [
                {
                  "IndexName": "role-index",
                  "KeySchema": [
                    {
                      "AttributeName": "role",
                      "KeyType": "HASH"
                    }
                  ],
                  "Projection": {
                    "ProjectionType": "ALL"
                  }
                },
                {
                  "IndexName": "user-index",
                  "KeySchema": [
                    {
                      "AttributeName": "user",
                      "KeyType": "HASH"
                    }
                  ],
                  "Projection": {
                    "ProjectionType": "ALL"
                  }
                }
              ],
              "TimeToLiveSpecification": {
                "AttributeName": "expiresAt",
                "Enabled": true
              }
            }
          },
          "MediaBucket": {
            "Type": "AWS::S3::Bucket",
            "Properties": {
              "BucketName": "${self:custom.mediaBucketName}",
              "CorsConfiguration": {
                "CorsRules": [
                  {
                    "AllowedHeaders": [
                      "*"
                    ],
                    "AllowedMethods": [
                      "GET",
                      "PUT",
                      "POST",
                      "DELETE",
                      "HEAD"
                    ],
                    "AllowedOrigins": [
                      "*"
                    ],
                    "MaxAge": 3000
                  }
                ]
              },
              "PublicAccessBlockConfiguration": {
                "BlockPublicAcls": true,
                "BlockPublicPolicy": true,
                "IgnorePublicAcls": true,
                "RestrictPublicBuckets": true
              }
            }
          }
        }
      }
    },
    "provider": {
      "name": "aws",
      "stage": "${opt:stage, 'dev'}",
      "region": "us-east-1",
      "runtime": "python3.11",
      "memorySize": 1024,
      "timeout": 30,
      "websocketsApiName": "${self:service}-ws-${sls:stage}",
      "websocketsApiRouteSelectionExpression": "$request.body.action",
      "httpApi": {
        "cors": {
          "allowedOrigins": [
            "*"
          ],
          "allowedHeaders": [
            "Content-Type",
            "Authorization",
            "X-Requested-With"
          ],
          "allowedMethods": [
            "OPTIONS",
            "GET",
            "POST",
            "PATCH",
            "PUT",
            "DELETE"
          ],
          "maxAge": 300
        }
      },
      "environment": {
        "USERS_TABLE": "${self:custom.usersTableName}",
        "AUTH_SECRET": "<REDACTED>",
        "SMTP_FROM_ADDRESS": "${opt:smtpFrom, env:SMTP_FROM_ADDRESS, 'marco.soto.m@utec.edu.pe'}",
        "SMTP_USERNAME": "${opt:smtpUser, env:SMTP_USERNAME, 'marco.soto.m@utec.edu.pe'}",
        "SMTP_PASSWORD": "<REDACTED>",
        "SMTP_HOST": "${opt:smtpHost, env:SMTP_HOST, 'smtp.gmail.com'}",
        "SMTP_PORT": "${opt:smtpPort, env:SMTP_PORT, '587'}",
        "INCIDENTS_TABLE": "${self:custom.incidentsTableName}",
        "CONNECTIONS_TABLE": "${self:custom.connectionsTableName}",
        "CONNECTION_TTL_SECONDS": "${opt:connectionTtl, env:CONNECTION_TTL_SECONDS, '3600'}",
        "SAGEMAKER_ENDPOINT_NAME": "${opt:sagemakerEndpoint, env:SAGEMAKER_ENDPOINT_NAME, ''}",
        "MEDIA_BUCKET_NAME": "${self:custom.mediaBucketName}",
        "WEBSOCKET_API_ENDPOINT": {
          "Fn::Join": [
            "",
            [
              "https://",
              {
                "Ref": "WebsocketsApi"
              },
              ".execute-api.",
              "${self:provider.region}",
              ".amazonaws.com/",
              "${self:provider.stage}"
            ]
          ]
        }
      },
      "iam": {
        "role": "arn:aws:iam::590953801135:role/LabRole"
      }
    },
    "error": {
      "message": "You must sign in or use a license key with Serverless Framework V.4 and later versions. Please use \"serverless login\".",
      "stack": "Error: You must sign in or use a license key with Serverless Framework V.4 and later versions. Please use \"serverless login\".\n    at Authentication.getAuthenticatedData (file:///Users/marcosotomaceda/.serverless/releases/4.23.0/package/dist/sf-core.js:717:11184)\n    at process.processTicksAndRejections (node:internal/process/task_queues:105:5)\n    at async Authentication.authenticate (file:///Users/marcosotomaceda/.serverless/releases/4.23.0/package/dist/sf-core.js:720:4103)\n    at async TraditionalRunner.resolveVariablesAndAuthenticate (file:///Users/marcosotomaceda/.serverless/releases/4.23.0/package/dist/sf-core.js:729:1380)\n    at async TraditionalRunner.run (file:///Users/marcosotomaceda/.serverless/releases/4.23.0/package/dist/sf-core.js:1356:27989)\n    at async route (file:///Users/marcosotomaceda/.serverless/releases/4.23.0/package/dist/sf-core.js:1531:2878)\n    at async Object.run (file:///Users/marcosotomaceda/.serverless/releases/4.23.0/package/dist/sf-core.js:1532:3845)\n    at async run2 (file:///Users/marcosotomaceda/.serverless/releases/4.23.0/package/dist/sf-core.js:1532:4999)"
    },
    "serviceRawFile": "org: marcosotomac\nservice: alertautec-auth\n\nprovider:\n  name: aws\n  stage: ${opt:stage, 'dev'}\n  region: us-east-1\n  runtime: python3.11\n  memorySize: 1024\n  timeout: 30\n  websocketsApiName: ${self:service}-ws-${sls:stage}\n  websocketsApiRouteSelectionExpression: $request.body.action\n  httpApi:\n    cors:\n      allowedOrigins:\n        - \"*\"\n      allowedHeaders:\n        - Content-Type\n        - Authorization\n        - X-Requested-With\n      allowedMethods:\n        - OPTIONS\n        - GET\n        - POST\n        - PATCH\n        - PUT\n        - DELETE\n      maxAge: 300\n  environment:\n    USERS_TABLE: ${self:custom.usersTableName}\n    AUTH_SECRET: ${opt:authSecret, env:AUTH_SECRET, 'dev-secret'}\n    SMTP_FROM_ADDRESS: ${opt:smtpFrom, env:SMTP_FROM_ADDRESS, 'marco.soto.m@utec.edu.pe'}\n    SMTP_USERNAME: ${opt:smtpUser, env:SMTP_USERNAME, 'marco.soto.m@utec.edu.pe'}\n    SMTP_PASSWORD: ${opt:smtpPassword, env:SMTP_PASSWORD, 'qyyt meet kior skgc'}\n    SMTP_HOST: ${opt:smtpHost, env:SMTP_HOST, 'smtp.gmail.com'}\n    SMTP_PORT: ${opt:smtpPort, env:SMTP_PORT, '587'}\n    INCIDENTS_TABLE: ${self:custom.incidentsTableName}\n    CONNECTIONS_TABLE: ${self:custom.connectionsTableName}\n    CONNECTION_TTL_SECONDS: ${opt:connectionTtl, env:CONNECTION_TTL_SECONDS, '3600'}\n    SAGEMAKER_ENDPOINT_NAME: ${opt:sagemakerEndpoint, env:SAGEMAKER_ENDPOINT_NAME, ''}\n    MEDIA_BUCKET_NAME: ${self:custom.mediaBucketName}\n    WEBSOCKET_API_ENDPOINT:\n      Fn::Join:\n        - \"\"\n        - - \"https://\"\n          - Ref: WebsocketsApi\n          - \".execute-api.\"\n          - ${self:provider.region}\n          - \".amazonaws.com/\"\n          - ${self:provider.stage}\n  iam:\n    role: arn:aws:iam::590953801135:role/LabRole\n\nfunctions:\n  register:\n    handler: src/handlers/auth/register.handler\n    description: Registers an institutional user and stores hashed credentials.\n    timeout: 10\n    events:\n      - httpApi:\n          method: post\n          path: /auth/register\n  login:\n    handler: src/handlers/auth/login.handler\n    description: Authenticates a user with institutional credentials and issues a session token.\n    timeout: 10\n    events:\n      - httpApi:\n          method: post\n          path: /auth/login\n  createIncident:\n    handler: src/handlers/incidents/create.handler\n    description: Creates a new incident report with urgency and location metadata.\n    timeout: 10\n    events:\n      - httpApi:\n          method: post\n          path: /incidents\n  listIncidents:\n    handler: src/handlers/incidents/list.handler\n    description: Lists incidents for dashboards with optional status filtering.\n    timeout: 10\n    events:\n      - httpApi:\n          method: get\n          path: /incidents\n  adminListIncidents:\n    handler: src/handlers/incidents/admin_list.handler\n    description: Allows authorities to view and filter all active incidents.\n    timeout: 10\n    events:\n      - httpApi:\n          method: get\n          path: /admin/incidents\n  updateIncident:\n    handler: src/handlers/incidents/update.handler\n    description: Updates incident status or assignment, reserved for personal/autoridad roles.\n    timeout: 10\n    events:\n      - httpApi:\n          method: patch\n          path: /incidents/{incidentId}\n  prioritizeIncident:\n    handler: src/handlers/incidents/prioritize.handler\n    description: Permite a autoridades priorizar incidentes para el panel.\n    timeout: 10\n    events:\n      - httpApi:\n          method: patch\n          path: /incidents/{incidentId}/priority\n  closeIncident:\n    handler: src/handlers/incidents/close.handler\n    description: Marca un incidente como resuelto desde el panel administrativo.\n    timeout: 10\n    events:\n      - httpApi:\n          method: patch\n          path: /incidents/{incidentId}/close\n  incidentHistory:\n    handler: src/handlers/incidents/history.handler\n    description: Devuelve el historial completo de acciones de un incidente.\n    timeout: 10\n    events:\n      - httpApi:\n          method: get\n          path: /incidents/{incidentId}/history\n  requestMediaUpload:\n    handler: src/handlers/incidents/request_upload.handler\n    description: Genera URLs prefirmadas para subir im치genes o videos de incidentes.\n    timeout: 10\n    events:\n      - httpApi:\n          method: post\n          path: /incidents/media/upload\n  getMediaUrl:\n    handler: src/handlers/incidents/get_media_url.handler\n    description: Genera URLs firmadas de lectura para archivos multimedia de incidentes.\n    timeout: 10\n    events:\n      - httpApi:\n          method: get\n          path: /incidents/media/{objectKey+}\n  commentIncident:\n    handler: src/handlers/incidents/comment.handler\n    description: Permite a usuarios dejar comentarios en un incidente.\n    timeout: 10\n    events:\n      - httpApi:\n          method: post\n          path: /incidents/{incidentId}/comments\n  voteSignificance:\n    handler: src/handlers/incidents/significance.handler\n    description: Incrementa la relevancia (significancia) de un incidente.\n    timeout: 10\n    events:\n      - httpApi:\n          method: post\n          path: /incidents/{incidentId}/significance\n  predictIncidents:\n    handler: src/handlers/analytics/predict.handler\n    description: Consulta SageMaker para identificar patrones y predicciones de riesgos.\n    timeout: 15\n    memorySize: 2048\n    events:\n      - httpApi:\n          method: post\n          path: /analytics/predictions\n  wsConnect:\n    handler: src/handlers/ws/connect.handler\n    description: Registers a WebSocket connection associated to the authenticated user.\n    events:\n      - websocket: $connect\n  wsDisconnect:\n    handler: src/handlers/ws/disconnect.handler\n    description: Cleans up WebSocket connections when clients disconnect.\n    events:\n      - websocket: $disconnect\n  wsDefault:\n    handler: src/handlers/ws/default.handler\n    description: Handles fallback WebSocket messages (pings/unsupported actions).\n    events:\n      - websocket: $default\n  wsPing:\n    handler: src/handlers/ws/ping.handler\n    description: Mantiene viva la conexi칩n y renueva el TTL para conexiones activas.\n    events:\n      - websocket: ping\n\npackage:\n  patterns:\n    - \"!node_modules/**\"\n    - \"!venv/**\"\n\ncustom:\n  usersTableName: ${self:service}-users-${sls:stage}\n  incidentsTableName: ${self:service}-incidents-${sls:stage}\n  connectionsTableName: ${self:service}-connections-${sls:stage}\n  mediaBucketName: ${self:service}-media-${sls:stage}\n\nresources:\n  Resources:\n    UsersTable:\n      Type: AWS::DynamoDB::Table\n      Properties:\n        TableName: ${self:custom.usersTableName}\n        BillingMode: PAY_PER_REQUEST\n        AttributeDefinitions:\n          - AttributeName: email\n            AttributeType: S\n        KeySchema:\n          - AttributeName: email\n            KeyType: HASH\n    IncidentsTable:\n      Type: AWS::DynamoDB::Table\n      Properties:\n        TableName: ${self:custom.incidentsTableName}\n        BillingMode: PAY_PER_REQUEST\n        AttributeDefinitions:\n          - AttributeName: incidentId\n            AttributeType: S\n          - AttributeName: status\n            AttributeType: S\n        KeySchema:\n          - AttributeName: incidentId\n            KeyType: HASH\n        GlobalSecondaryIndexes:\n          - IndexName: status-index\n            KeySchema:\n              - AttributeName: status\n                KeyType: HASH\n            Projection:\n              ProjectionType: ALL\n    ConnectionsTable:\n      Type: AWS::DynamoDB::Table\n      Properties:\n        TableName: ${self:custom.connectionsTableName}\n        BillingMode: PAY_PER_REQUEST\n        AttributeDefinitions:\n          - AttributeName: connectionId\n            AttributeType: S\n          - AttributeName: role\n            AttributeType: S\n          - AttributeName: user\n            AttributeType: S\n        KeySchema:\n          - AttributeName: connectionId\n            KeyType: HASH\n        GlobalSecondaryIndexes:\n          - IndexName: role-index\n            KeySchema:\n              - AttributeName: role\n                KeyType: HASH\n            Projection:\n              ProjectionType: ALL\n          - IndexName: user-index\n            KeySchema:\n              - AttributeName: user\n                KeyType: HASH\n            Projection:\n              ProjectionType: ALL\n        TimeToLiveSpecification:\n          AttributeName: expiresAt\n          Enabled: true\n    MediaBucket:\n      Type: AWS::S3::Bucket\n      Properties:\n        BucketName: ${self:custom.mediaBucketName}\n        CorsConfiguration:\n          CorsRules:\n            - AllowedHeaders: [\"*\"]\n              AllowedMethods: [\"GET\", \"PUT\", \"POST\", \"DELETE\", \"HEAD\"]\n              AllowedOrigins: [\"*\"]\n              MaxAge: 3000\n        PublicAccessBlockConfiguration:\n          BlockPublicAcls: true\n          BlockPublicPolicy: true\n          IgnorePublicAcls: true\n          RestrictPublicBuckets: true\n",
    "command": [
      "info"
    ],
    "options": {
      "stage": "dev"
    },
    "serviceProviderAwsCfStackId": null,
    "serviceProviderAwsCfStackCreated": null,
    "serviceProviderAwsCfStackUpdated": null,
    "serviceProviderAwsCfStackStatus": null,
    "serviceProviderAwsCfStackOutputs": null
  }
}